{
   "className": "AccountingSummary",
   "summary": "Accounting Summary",
   "description": [
      {
         "line": "Used in qsub for summing up usage values (?)."
      },
      {
         "line": "It contains some of the fields which can appear in the qacct -j job_id output."
      },
      {
         "line": "See also the sge_accounting(5) man page."
      }
   ],
   "cullPrefix": "QAJ",
   "attributes": [
      {
         "name": "host",
         "summary": "Host Name",
         "description": [
            {
               "line": "Host where a job ran."
            }
         ],
         "type": "lHostT",
         "flags": []
      },
      {
         "name": "queue",
         "summary": "Cluster Queue Name",
         "description": [
            {
               "line": "Cluster queue in which a job ran."
            }
         ],
         "type": "lStringT",
         "flags": []
      },
      {
         "name": "group",
         "summary": "User Group",
         "description": [
            {
               "line": "Unix user group of the job owner."
            }
         ],
         "type": "lStringT",
         "flags": []
      },
      {
         "name": "owner",
         "summary": "Owner",
         "description": [
            {
               "line": "Unix user name of the job owner."
            }
         ],
         "type": "lStringT",
         "flags": []
      },
      {
         "name": "project",
         "summary": "Project",
         "description": [
            {
               "line": "Project the job was running for."
            }
         ],
         "type": "lStringT",
         "flags": []
      },
      {
         "name": "department",
         "summary": "Department",
         "description": [
            {
               "line": "The job owner's department."
            }
         ],
         "type": "lStringT",
         "flags": []
      },
      {
         "name": "ru_wallclock",
         "summary": "Rusage Wallclock",
         "description": [
            {
               "line": "Wallclock time from rusage (end time - start_time)."
            }
         ],
         "type": "lDoubleT",
         "flags": []
      },
      {
         "name": "ru_utime",
         "summary": "Rusage User Time",
         "description": [
            {
               "line": "User CPU time from rusage."
            }
         ],
         "type": "lDoubleT",
         "flags": []
      },
      {
         "name": "ru_stime",
         "summary": "Rusage System Time",
         "description": [
            {
               "line": "System CPU time from rusage."
            }
         ],
         "type": "lDoubleT",
         "flags": []
      },
      {
         "name": "ru_maxrss",
         "summary": "Rusage Maximum RSS",
         "description": [
            {
               "line": "Maximum resident set size of the job's processes from rusage."
            }
         ],
         "type": "lDoubleT",
         "flags": []
      },
      {
         "name": "ru_inblock",
         "summary": "Rusage Block Input",
         "description": [
            {
               "line": "Number of block input operations from rusage."
            }
         ],
         "type": "lDoubleT",
         "flags": []
      },
      {
         "name": "granted_pe",
         "summary": "Granted Parallel Environment",
         "description": [
            {
               "line": "In case of a parallel job: The PE the job was running in."
            }
         ],
         "type": "lStringT",
         "flags": []
      },
      {
         "name": "slots",
         "summary": "Slots",
         "description": [
            {
               "line": "The number of slots the job occupied."
            }
         ],
         "type": "lUlongT",
         "flags": []
      },
      {
         "name": "cpu",
         "summary": "Cpu Usage",
         "description": [
            {
               "line": "The cpu usage of the job reported by sge_execd in seconds."
            }
         ],
         "type": "lDoubleT",
         "flags": []
      },
      {
         "name": "mem",
         "summary": "Integral Memory Usage",
         "description": [
            {
               "line": "The integral memory usage of the job reported by sge_execd in Gbytes cpu seconds."
            }
         ],
         "type": "lDoubleT",
         "flags": []
      },
      {
         "name": "io",
         "summary": "IO Usage",
         "description": [
            {
               "line": "The IO usage of the job reported by sge_execd (the amount of data transferred in input and output operations."
            }
         ],
         "type": "lDoubleT",
         "flags": []
      },
      {
         "name": "iow",
         "summary": "IO Wait Time",
         "description": [
            {
               "line": "The amount of time the job waited for IO operations to happen as reported by sge_execd."
            }
         ],
         "type": "lDoubleT",
         "flags": []
      },
      {
         "name": "maxvmem",
         "summary": "Maximum Virtual Memory",
         "description": [
            {
               "line": "The maximum virtual memory usage of the job reported by sge_execd."
            }
         ],
         "type": "lDoubleT",
         "flags": []
      },
      {
         "name": "arid",
         "summary": "AR Id",
         "description": [
            {
               "line": "The id of an advance reservation the job might have run in."
            }
         ],
         "type": "lUlongT",
         "flags": []
      }
   ]
}
