{
   "className": "Acknowledge",
   "summary": "@todo add summary",
   "description": [
      {
         "line": "@todo add description"
      }
   ],
   "cullPrefix": "ACK",
   "attributes": [
      {
         "name": "type",
         "summary": "@todo add summary",
         "description": [
            {
               "line": "@todo add description"
            }
         ],
         "type": "lUlongT",
         "flags": [
            {
               "name": "JGDI_HIDDEN"
            }
         ]
      },
      {
         "name": "id",
         "summary": "@todo add summary",
         "description": [
            {
               "line": "@todo add description"
            }
         ],
         "type": "lUlongT",
         "flags": [
            {
               "name": "JGDI_HIDDEN"
            }
         ]
      },
      {
         "name": "id2",
         "summary": "@todo add summary",
         "description": [
            {
               "line": "@todo add description"
            }
         ],
         "type": "lUlongT",
         "flags": [
            {
               "name": "JGDI_HIDDEN"
            }
         ]
      },
      {
         "name": "str",
         "summary": "@todo add summary",
         "description": [
            {
               "line": "@todo add description"
            }
         ],
         "type": "lStringT",
         "flags": [
            {
               "name": "JGDI_HIDDEN"
            }
         ]
      }
   ]
}
