{
   "className": "MailReceiver",
   "summary": "Mail Receiver",
   "description": [
      {
         "line": "One object of this type specifies a mail receiver, meaning an email address"
      },
      {
         "line": "in the form user@host."
      },
      {
         "line": "It is used e.g. when submitting jobs via qsub -M user[@host][,user[@host],...]"
      },
      {
         "line": "@todo why do we split it into user and host? We could just have a single string holding an email address."
      }
   ],
   "cullPrefix": "MR",
   "attributes": [
      {
         "name": "user",
         "summary": "User Name",
         "description": [
            {
               "line": "User name of the mail receipient"
            }
         ],
         "type": "lStringT",
         "flags": [
            {
               "name": "PRIMARY_KEY"
            },
            {
               "name": "SPOOL_SUBLIST"
            }
         ]
      },
      {
         "name": "host",
         "summary": "Host Name",
         "description": [
            {
               "line": "Host / Domain part of a mail receipient."
            }
         ],
         "type": "lHostT",
         "flags": [
            {
               "name": "SPOOL_SUBLIST"
            }
         ]
      }
   ]
}
