{
   "className": "SchedulerConfigParameter",
   "summary": "@todo add summary",
   "description": [
      {
         "line": "@todo add description"
      }
   ],
   "cullPrefix": "PARA",
   "attributes": [
      {
         "name": "name",
         "summary": "@todo add summary",
         "description": [
            {
               "line": "@todo add description"
            }
         ],
         "type": "lStringT",
         "flags": [
            {
               "name": "PRIMARY_KEY"
            }
         ]
      },
      {
         "name": "value",
         "summary": "@todo add summary",
         "description": [
            {
               "line": "@todo add description"
            }
         ],
         "type": "lStringT",
         "flags": []
      }
   ]
}
