{
   "className": "PtfJob",
   "summary": "PTF Job",
   "description": [
      {
         "line": "This is the list type we use to hold the jobs which are running under the local execution daemon."
      },
      {
         "line": "@todo This is a very old module and probably noone really knows its details any more. Add better documentation."
      }
   ],
   "cullPrefix": "JL",
   "attributes": [
      {
         "name": "job_ID",
         "summary": "Job Id",
         "description": [
            {
               "line": "The Job Id."
            }
         ],
         "type": "lUlongT",
         "flags": [
            {
               "name": "PRIMARY_KEY"
            },
            {
               "name": "UNIQUE"
            },
            {
               "name": "HASH"
            }
         ]
      },
      {
         "name": "OS_job_list",
         "summary": "OS Job List",
         "description": [
            {
               "line": "List of OS jobs (JO_Type). There should be one per running Array/PE task having one os job id each."
            }
         ],
         "type": "lListT",
         "subClassName": "JO",
         "subCullPrefix": "JO",
         "flags": []
      },
      {
         "name": "state",
         "summary": "State",
         "description": [
            {
               "line": "Job State, one of JL_JOB_ACTIVE, JL_JOB_COMPLETE, JL_JOB_DELETED."
            }
         ],
         "type": "lUlongT",
         "flags": []
      },
      {
         "name": "tickets",
         "summary": "Tickets",
         "description": [
            {
               "line": "Job Tickets. Used for reprioritization."
            }
         ],
         "type": "lUlongT",
         "flags": []
      },
      {
         "name": "share",
         "summary": "Share",
         "description": [
            {
               "line": "ptf interval share"
            }
         ],
         "type": "lDoubleT",
         "flags": []
      },
      {
         "name": "ticket_share",
         "summary": "Ticket Share",
         "description": [
            {
               "line": "ptf job ticket share"
            }
         ],
         "type": "lDoubleT",
         "flags": []
      },
      {
         "name": "timeslice",
         "summary": "Timeslice",
         "description": [
            {
               "line": "ptf calculated timeslice (SX)"
            }
         ],
         "type": "lDoubleT",
         "flags": []
      },
      {
         "name": "usage",
         "summary": "Usage",
         "description": [
            {
               "line": "ptf interval combined usage"
            }
         ],
         "type": "lDoubleT",
         "flags": []
      },
      {
         "name": "old_usage_value",
         "summary": "Old Usage",
         "description": [
            {
               "line": "ptf interval combined usage"
            }
         ],
         "type": "lDoubleT",
         "flags": []
      },
      {
         "name": "adjusted_usage",
         "summary": "Adjusted Usage",
         "description": [
            {
               "line": "ptf interval adjusted usage"
            }
         ],
         "type": "lDoubleT",
         "flags": []
      },
      {
         "name": "last_usage",
         "summary": "Last Usage",
         "description": [
            {
               "line": "ptf last interval combined usage"
            }
         ],
         "type": "lDoubleT",
         "flags": []
      },
      {
         "name": "old_usage",
         "summary": "Old Usage",
         "description": [
            {
               "line": "prev interval combined usage"
            }
         ],
         "type": "lDoubleT",
         "flags": []
      },
      {
         "name": "proportion",
         "summary": "Proportion",
         "description": [
            {
               "line": "@todo add description"
            }
         ],
         "type": "lDoubleT",
         "flags": []
      },
      {
         "name": "adjusted_proportion",
         "summary": "Adjusted Proportion",
         "description": [
            {
               "line": "@todo add description"
            }
         ],
         "type": "lDoubleT",
         "flags": []
      },
      {
         "name": "adjusted_current_proportion",
         "summary": "Adjusted Current Proportion",
         "description": [
            {
               "line": "@todo add description"
            }
         ],
         "type": "lDoubleT",
         "flags": []
      },
      {
         "name": "actual_proportion",
         "summary": "Actual Proportion",
         "description": [
            {
               "line": "@todo add description"
            }
         ],
         "type": "lDoubleT",
         "flags": []
      },
      {
         "name": "diff_proportion",
         "summary": "Diff Proportion",
         "description": [
            {
               "line": "@todo add description"
            }
         ],
         "type": "lDoubleT",
         "flags": []
      },
      {
         "name": "last_proportion",
         "summary": "Last Proportion",
         "description": [
            {
               "line": "@todo add description"
            }
         ],
         "type": "lDoubleT",
         "flags": []
      },
      {
         "name": "curr_pri",
         "summary": "Current Priority",
         "description": [
            {
               "line": "@todo add description"
            }
         ],
         "type": "lDoubleT",
         "flags": []
      },
      {
         "name": "pri",
         "summary": "Priority",
         "description": [
            {
               "line": "@todo add description"
            }
         ],
         "type": "lLongT",
         "flags": []
      },
      {
         "name": "procfd",
         "summary": "Proc FD",
         "description": [
            {
               "line": "proc file descriptor"
            }
         ],
         "type": "lUlongT",
         "flags": []
      },
      {
         "name": "interactive",
         "summary": "Interactive",
         "description": [
            {
               "line": "interactive flag"
            }
         ],
         "type": "lUlongT",
         "flags": []
      }
   ]
}
