{
   "className": "FunctionalCategory",
   "summary": "Functional Category",
   "description": [
      {
         "line": "Objects of this type are used to sort the job list in the scheduler."
      },
      {
         "line": "All attributes are references to objects in other lists."
      }
   ],
   "cullPrefix": "FCAT",
   "attributes": [
      {
         "name": "job_share",
         "summary": "Job Share",
         "description": [
            {
               "line": "All jobs in this functional category have this amount of jobs shares."
            }
         ],
         "type": "lUlongT",
         "flags": []
      },
      {
         "name": "user_share",
         "summary": "User Share",
         "description": [
            {
               "line": "All jobs in this functional category have this amount of user shares."
            }
         ],
         "type": "lUlongT",
         "flags": []
      },
      {
         "name": "user",
         "summary": "User",
         "description": [
            {
               "line": "Pointer to the user structure."
            }
         ],
         "type": "lRefT",
         "subClassName": "ANY",
         "subCullPrefix": "ANY",
         "flags": []
      },
      {
         "name": "project_share",
         "summary": "Project Share",
         "description": [
            {
               "line": "All jobs in this functional category have this amount of project shares."
            }
         ],
         "type": "lUlongT",
         "flags": []
      },
      {
         "name": "project",
         "summary": "Project",
         "description": [
            {
               "line": "Pointer to the project structure."
            }
         ],
         "type": "lRefT",
         "subClassName": "ANY",
         "subCullPrefix": "ANY",
         "flags": []
      },
      {
         "name": "dept_share",
         "summary": "Department Share",
         "description": [
            {
               "line": "All jobs in this functional category have this amount of department shares."
            }
         ],
         "type": "lUlongT",
         "flags": []
      },
      {
         "name": "dept",
         "summary": "Department",
         "description": [
            {
               "line": "Pointer to the department structure."
            }
         ],
         "type": "lRefT",
         "subClassName": "ANY",
         "subCullPrefix": "ANY",
         "flags": []
      },
      {
         "name": "jobrelated_ticket_first",
         "summary": "First Job Related Ticket",
         "description": [
            {
               "line": "Pointer to the first element of job ticket list."
            }
         ],
         "type": "lRefT",
         "subClassName": "ANY",
         "subCullPrefix": "ANY",
         "flags": []
      },
      {
         "name": "jobrelated_ticket_last",
         "summary": "Last Job Related Ticket",
         "description": [
            {
               "line": "Pointer to the last element in the job ticket list."
            }
         ],
         "type": "lRefT",
         "subClassName": "ANY",
         "subCullPrefix": "ANY",
         "flags": []
      }
   ]
}
