{
   "className": "LoadReference",
   "summary": "@todo add summary",
   "description": [
      {
         "line": "@todo add description"
      }
   ],
   "cullPrefix": "LDR",
   "attributes": [
      {
         "name": "queue_ref_list",
         "summary": "@todo add summary",
         "description": [
            {
               "line": "@todo add description"
            }
         ],
         "type": "lListT",
         "subClassName": "QueueReference",
         "subCullPrefix": "QR",
         "flags": []
      },
      {
         "name": "limit",
         "summary": "@todo add summary",
         "description": [
            {
               "line": "@todo add description"
            }
         ],
         "type": "lStringT",
         "flags": []
      },
      {
         "name": "global",
         "summary": "@todo add summary",
         "description": [
            {
               "line": "@todo add description"
            }
         ],
         "type": "lRefT",
         "subClassName": "ANY",
         "subCullPrefix": "ANY",
         "flags": []
      },
      {
         "name": "host",
         "summary": "@todo add summary",
         "description": [
            {
               "line": "@todo add description"
            }
         ],
         "type": "lRefT",
         "subClassName": "ANY",
         "subCullPrefix": "ANY",
         "flags": []
      },
      {
         "name": "queue",
         "summary": "@todo add summary",
         "description": [
            {
               "line": "@todo add description"
            }
         ],
         "type": "lRefT",
         "subClassName": "ANY",
         "subCullPrefix": "ANY",
         "flags": []
      }
   ]
}
