{
   "className": "NamedStringVector",
   "summary": "Named String Vector",
   "description": [
      {
         "line": "Used in the DRMAA library to implement vector job template attributes."
      }
   ],
   "cullPrefix": "NSV",
   "attributes": [
      {
         "name": "name",
         "summary": "Name",
         "description": [
            {
               "line": "Name of the string vector."
            }
         ],
         "type": "lStringT",
         "flags": []
      },
      {
         "name": "strings",
         "summary": "Strings",
         "description": [
            {
               "line": "Strings of this string vector."
            }
         ],
         "type": "lListT",
         "subClassName": "ST",
         "subCullPrefix": "ST",
         "flags": []
      }
   ]
}
