{
   "className": "Calendar",
   "summary": "Calendar",
   "description": [
      {
         "line": "This data structure represents the SGE calendar object."
      }
   ],
   "cullPrefix": "CAL",
   "attributes": [
      {
         "name": "name",
         "summary": "Name",
         "description": [
            {
               "line": "The calendar name."
            },
            {
               "line": "See man page sge_calendar_conf.5 for detailed information about the attributes."
            }
         ],
         "type": "lStringT",
         "flags": [
            {
               "name": "PRIMARY_KEY"
            },
            {
               "name": "UNIQUE"
            },
            {
               "name": "HASH"
            },
            {
               "name": "JGDI_CONF"
            },
            {
               "name": "SPOOL"
            }
         ]
      },
      {
         "name": "year_calendar",
         "summary": "Year Calendar",
         "description": [
            {
               "line": "A year calendar as string, e.g. 12.03.2004=12-11=off."
            }
         ],
         "type": "lStringT",
         "flags": [
            {
               "name": "JGDI_CONF"
            },
            {
               "name": "SPOOL"
            }
         ]
      },
      {
         "name": "week_calendar",
         "summary": "Week Calendar",
         "description": [
            {
               "line": "A week calendar as string, e.g. mon-fri=6-20=suspended."
            }
         ],
         "type": "lStringT",
         "flags": [
            {
               "name": "JGDI_CONF"
            },
            {
               "name": "SPOOL"
            }
         ]
      },
      {
         "name": "parsed_year_calendar",
         "summary": "Parsed Year Calendar",
         "description": [
            {
               "line": "The year calendar parsed to internal data structures."
            }
         ],
         "type": "lListT",
         "subClassName": "CA",
         "subCullPrefix": "CA",
         "flags": [
            {
               "name": "JGDI_HIDDEN"
            }
         ]
      },
      {
         "name": "parsed_week_calendar",
         "summary": "Parsed Week Calendar",
         "description": [
            {
               "line": "The week calendar parsed to internal data structures."
            }
         ],
         "type": "lListT",
         "subClassName": "CA",
         "subCullPrefix": "CA",
         "flags": [
            {
               "name": "JGDI_HIDDEN"
            }
         ]
      },
      {
         "name": "joker",
         "summary": "Joker",
         "description": [
            {
               "line": "Placeholder which can be used for arbitrary data."
            },
            {
               "line": "Its purpose is to be able to add new attributes without changing the spooling format."
            },
            {
               "line": "It is a list of arbitrary type and it is spooled."
            }
         ],
         "type": "lListT",
         "subClassName": "Variable",
         "subCullPrefix": "VA",
         "flags": [
            {"name": "SPOOL"}
         ]
      }
   ]
}
