{
   "className": "SubmitUser",
   "summary": "Submit User",
   "description": [
      {
         "line": "The list of these objects defines which users are allowed to submit jobs into Cluster Scheduler."
      },
      {
         "line": "It is also used to count the number of active jobs of the user."
      }
   ],
   "cullPrefix": "SU",
   "attributes": [
      {
         "name": "name",
         "summary": "Name",
         "description": [
            {
               "line": "User Name"
            }
         ],
         "type": "lStringT",
         "flags": [
            {
               "name": "UNIQUE"
            },
            {
               "name": "HASH"
            }
         ]
      },
      {
         "name": "jobs",
         "summary": "Jobs",
         "description": [
            {
               "line": "Currently active jobs for this user (including jobs in finished state)."
            }
         ],
         "type": "lUlongT",
         "flags": []
      }
   ]
}
