{
   "className": "AttributeBoolean",
   "summary": "Attribute Boolean",
   "description": [
      {
         "line": "Used for boolean attributes in the cluster queues."
      },
      {
         "line": "Used for the queue rerun attribute."
      }
   ],
   "cullPrefix": "ABOOL",
   "attributes": [
      {
         "name": "href",
         "summary": "Host Reference",
         "description": [
            {
               "line": "Name of a host or a host group."
            }
         ],
         "type": "lHostT",
         "flags": [
            {
               "name": "PRIMARY_KEY"
            },
            {
               "name": "UNIQUE"
            },
            {
               "name": "HASH"
            },
            {
               "name": "SPOOL_SUBLIST"
            }
         ]
      },
      {
         "name": "value",
         "summary": "Value",
         "description": [
            {
               "line": "The boolean value."
            }
         ],
         "type": "lBoolT",
         "flags": [
            {
               "name": "SPOOL_SUBLIST"
            }
         ]
      }
   ]
}
